{
  "schemaVersion": 1,
  "template": false,
  "agent": {
    "name": "ur-nexus",
    "version": "1.85.0",
    "commit": "13212837497aa008dd79cd4ea6b0faf929a60c59"
  },
  "date": "2026-09-01T11:19:10.157Z",
  "benchmark": {
    "name": "local-smoke",
    "category": "internal-regression",
    "taskCount": 6
  },
  "runtime": {
    "provider": "local-regression",
    "model": "none",
    "environment": {
      "platform": "darwin",
      "arch": "arm64",
      "node": "v26.8.1",
      "bun": "1.4.0",
      "cwd": "/Users/maith/Desktop/ur3-dev/UR-1.81.1"
    }
  },
  "results": {
    "passed": 6,
    "failed": 0,
    "passRate": 1,
    "taskResults": [
      {
        "id": "simple-file-edit",
        "name": "simple file edit task",
        "category": "terminal-coding",
        "passed": true,
        "wallTimeMs": 20,
        "failureCategory": null
      },
      {
        "id": "failing-test-repair",
        "name": "failing test repair task",
        "category": "terminal-coding",
        "passed": true,
        "wallTimeMs": 189,
        "failureCategory": null
      },
      {
        "id": "provider-routing",
        "name": "provider routing task",
        "category": "provider-routing",
        "passed": true,
        "wallTimeMs": 205,
        "failureCategory": null
      },
      {
        "id": "sandbox-denial",
        "name": "sandbox denial task",
        "category": "sandbox-safety",
        "passed": true,
        "wallTimeMs": 574,
        "failureCategory": null
      },
      {
        "id": "tool-call-parsing",
        "name": "tool-call parsing task",
        "category": "tool-use",
        "passed": true,
        "wallTimeMs": 177,
        "failureCategory": null
      },
      {
        "id": "multi-step-coding",
        "name": "multi-step coding task",
        "category": "terminal-coding",
        "passed": true,
        "wallTimeMs": 6062,
        "failureCategory": null
      }
    ],
    "failedTasks": [],
    "failureCategories": {},
    "wallTimeMs": 7228,
    "tokenUsage": null,
    "costUSD": null
  },
  "reproduction": {
    "command": "bun run benchmark:smoke",
    "inputReport": null,
    "generatedBy": "scripts/benchmark-report.mjs"
  }
}
