{
  "schemaVersion": 1,
  "template": false,
  "agent": {
    "name": "ur-nexus",
    "version": "1.87.0",
    "commit": "e81469b4554d5c209081df72d0350ffe8e59eca7",
    "source": {
      "dirty": true,
      "sha256": "79386b84a20b31475034a09e397910ec93c2462110f135a23c8a6f776ab6a453",
      "files": 2571,
      "scope": "src,scripts,package.json,bun.lock,tsconfig.json at report generation"
    }
  },
  "date": "2026-10-21T04:03:36.081Z",
  "benchmark": {
    "name": "local-regression",
    "category": "internal-regression",
    "taskCount": 20
  },
  "runtime": {
    "provider": "local-regression",
    "model": "none",
    "environment": {
      "platform": "darwin",
      "arch": "arm64",
      "node": "v26.10.0",
      "bun": "1.3.14",
      "cwd": "/Users/maith/Desktop/ur3-dev/UR-1.81.1"
    }
  },
  "results": {
    "passed": 20,
    "failed": 0,
    "passRate": 1,
    "taskResults": [
      {
        "id": "simple-file-edit",
        "name": "simple file edit task",
        "category": "terminal-coding",
        "passed": true,
        "wallTimeMs": 186,
        "failureCategory": null
      },
      {
        "id": "repo-edit-apply",
        "name": "repository edit apply task",
        "category": "terminal-coding",
        "passed": true,
        "wallTimeMs": 1016,
        "failureCategory": null
      },
      {
        "id": "repo-edit-ast",
        "name": "repository AST edit task",
        "category": "terminal-coding",
        "passed": true,
        "wallTimeMs": 10016,
        "failureCategory": null
      },
      {
        "id": "repo-edit-imports",
        "name": "repository import edit task",
        "category": "terminal-coding",
        "passed": true,
        "wallTimeMs": 5608,
        "failureCategory": null
      },
      {
        "id": "repo-edit-move",
        "name": "repository move edit task",
        "category": "terminal-coding",
        "passed": true,
        "wallTimeMs": 6904,
        "failureCategory": null
      },
      {
        "id": "failing-test-repair",
        "name": "failing test repair task",
        "category": "terminal-coding",
        "passed": true,
        "wallTimeMs": 208,
        "failureCategory": null
      },
      {
        "id": "provider-routing",
        "name": "provider routing task",
        "category": "provider-routing",
        "passed": true,
        "wallTimeMs": 213,
        "failureCategory": null
      },
      {
        "id": "provider-reliability",
        "name": "provider reliability task",
        "category": "provider-routing",
        "passed": true,
        "wallTimeMs": 189,
        "failureCategory": null
      },
      {
        "id": "provider-streaming",
        "name": "provider streaming task",
        "category": "provider-routing",
        "passed": true,
        "wallTimeMs": 196,
        "failureCategory": null
      },
      {
        "id": "provider-tool-calls",
        "name": "provider tool-call task",
        "category": "tool-use",
        "passed": true,
        "wallTimeMs": 183,
        "failureCategory": null
      },
      {
        "id": "provider-multimodal",
        "name": "provider multimodal mapping task",
        "category": "provider-routing",
        "passed": true,
        "wallTimeMs": 182,
        "failureCategory": null
      },
      {
        "id": "sandbox-policy",
        "name": "sandbox denial task",
        "category": "sandbox-safety",
        "passed": true,
        "wallTimeMs": 593,
        "failureCategory": null
      },
      {
        "id": "safety-matrix",
        "name": "safety matrix proof task",
        "category": "sandbox-safety",
        "passed": true,
        "wallTimeMs": 94,
        "failureCategory": null
      },
      {
        "id": "sandbox-adapter",
        "name": "sandbox adapter task",
        "category": "sandbox-safety",
        "passed": true,
        "wallTimeMs": 542,
        "failureCategory": null
      },
      {
        "id": "sandbox-profile",
        "name": "sandbox profile task",
        "category": "sandbox-safety",
        "passed": true,
        "wallTimeMs": 61,
        "failureCategory": null
      },
      {
        "id": "release-hygiene",
        "name": "release hygiene task",
        "category": "internal-regression",
        "passed": true,
        "wallTimeMs": 63,
        "failureCategory": null
      },
      {
        "id": "benchmark-schema",
        "name": "benchmark schema validation task",
        "category": "internal-regression",
        "passed": true,
        "wallTimeMs": 1106,
        "failureCategory": null
      },
      {
        "id": "eval-compare",
        "name": "eval comparison task",
        "category": "internal-regression",
        "passed": true,
        "wallTimeMs": 93,
        "failureCategory": null
      },
      {
        "id": "tool-call-parsing",
        "name": "tool-call parsing task",
        "category": "tool-use",
        "passed": true,
        "wallTimeMs": 173,
        "failureCategory": null
      },
      {
        "id": "multi-step-code-modification",
        "name": "multi-step code modification task",
        "category": "terminal-coding",
        "passed": true,
        "wallTimeMs": 992,
        "failureCategory": null
      }
    ],
    "failedTasks": [],
    "failureCategories": {},
    "wallTimeMs": 28619,
    "tokenUsage": null,
    "costUSD": null,
    "completionClaims": null,
    "falseCompletions": null,
    "falseCompletionRate": null
  },
  "reproduction": {
    "command": "bun run benchmark:local",
    "inputReport": null,
    "generatedBy": "scripts/benchmark-report.mjs"
  }
}
